{
  "loop": "repo-closed-loop",
  "agent": "claude-laptop",
  "started": "2026-09-02T09:21:00Z",
  "ended": "2026-09-02T09:58:00Z",
  "status": "success",
  "prs_opened": 2,
  "prs_merged": 0,
  "prs_closed": 0,
  "tests_added": 14,
  "repos_touched": ["kinz-margin-guardian-pipeline", "kinz-secure-commerce-hub"],
  "errors": []
}
