{
  "loop": "repo-closed-loop",
  "agent": "claude-laptop",
  "started": "2026-09-23T13:25:00+00:00",
  "ended": "2026-09-23T15:25:00+00:00",
  "status": "success",
  "prs_opened": 2,
  "prs_merged": 1,
  "prs_closed": 0,
  "tests_added": 3,
  "repos_touched": ["analytics-service-toolkit", "btc-llm-sentiment"],
  "errors": []
}
