{
  "loop": "cloud-improvements",
  "run_url": "https://claude.ai/code/session_01FaHCUTvU3YqUz4jfSriaC7",
  "started": "2026-09-25T00:23:00Z",
  "ended": "2026-09-25T01:01:00Z",
  "status": "success",
  "prs_opened": 2,
  "prs_merged": 2,
  "prs_closed": 0,
  "tests_added": 3,
  "repos_touched": [
    "kinz-margin-guardian-pipeline",
    "kinz-secure-commerce-hub"
  ],
  "pr_urls": [
    "https://github.com/nassim0014/kinz-margin-guardian-pipeline/pull/25",
    "https://github.com/nassim0014/kinz-secure-commerce-hub/pull/62"
  ],
  "summary": "kinz-margin-guardian-pipeline: fixed a false README claim (it said Slack/Email alerts, only Slack is implemented) with a regression test tying the README's claim to the alert functions that actually exist, PR #25 merged. kinz-secure-commerce-hub: fixed a zero-price division-by-zero in run_etl.py's margin_pct calculation that silently wrote inf/-inf into products_enriched.csv, found while closing a coverage-gap backlog item, PR #62 merged. Repos picked from rotation_cursor 4 (kinz-margin-guardian-pipeline, kinz-secure-commerce-hub); cursor advanced to 6.",
  "errors": []
}
