{
  "loop": "cloud-daily-commit",
  "run_url": "https://claude.ai/code/session_01Rzg6vES6Nj5h4CLrqAzwv9",
  "started": "2026-09-25T05:46:36Z",
  "ended": "2026-09-25T05:52:00Z",
  "status": "skipped",
  "prs_opened": 0,
  "prs_merged": 0,
  "prs_closed": 0,
  "tests_added": 0,
  "repos_touched": [],
  "pr_urls": [],
  "summary": "Something already landed today (Africa/Tunis) before this job ran: commits authored by nassim0014 on kinz-margin-guardian-pipeline (PR #25, 00:57 UTC), kinz-secure-commerce-hub (PR #62, 00:59 UTC), and Next.js-SaaS (PR #94, 00:56 UTC), all from earlier cloud-improvements/cloud-maintenance runs tonight. Per prompts/daily-commit.md step 2, stopped without making a new change.",
  "errors": []
}
