{
  "loop": "cloud-maintenance",
  "run_url": "https://claude.ai/code/session_018zyBEjzg9Gnb8xDskGcys7",
  "started": "2026-09-24T00:35:00Z",
  "ended": "2026-09-24T01:03:00Z",
  "status": "partial",
  "prs_opened": 2,
  "prs_merged": 5,
  "prs_closed": 1,
  "tests_added": 15,
  "repos_touched": [
    "feed-quality-gate",
    "kinz-secure-commerce-hub",
    "Next.js-SaaS",
    "kinz-accounting-analysis-20260623-102129"
  ],
  "pr_urls": [
    "https://github.com/nassim0014/feed-quality-gate/pull/3",
    "https://github.com/nassim0014/kinz-secure-commerce-hub/pull/54",
    "https://github.com/nassim0014/Next.js-SaaS/pull/92",
    "https://github.com/nassim0014/Next.js-SaaS/pull/93",
    "https://github.com/nassim0014/Next.js-SaaS/pull/81",
    "https://github.com/nassim0014/kinz-accounting-analysis-20260623-102129/pull/22"
  ],
  "summary": "Merged 5 green PRs (feed-quality-gate #3, kinz-secure-commerce-hub #54, Next.js-SaaS #92/#93, kinz-accounting #22) and closed Next.js-SaaS #81 in favor of its fix. btc-llm-sentiment's default branch CI is red (missing 'requests' dep) and the existing fix PR #58 can't be auto-merged because it edits .github/workflows/ci.yml, which the merge rules categorically forbid — needs Nassim to merge it by hand. Left open and reported: 4 dependabot PRs in kinz-secure-commerce-hub and 2 in Next.js-SaaS (rebase already requested within 48h, or a genuine breaking API change in @ai-sdk/react needing owner review). All other repos (analytics-service-toolkit, kinz-competitor-intelligence, kinz-margin-guardian-pipeline, kinz-price-bridge) were already green with no open PRs and pull_request CI already configured.",
  "errors": []
}
