{
  "loop": "repo-genesis-loop",
  "agent": "claude-laptop",
  "started": "2026-09-02T13:00:12Z",
  "ended": "2026-09-02T13:04:46Z",
  "status": "skipped",
  "prs_opened": 0,
  "prs_merged": 0,
  "prs_closed": 0,
  "tests_added": 0,
  "repos_touched": [],
  "errors": [
    "28-day anchor gate closed: day 14 of 28 (anchor 2026-08-19, today 2026-09-02, 14 % 28 != 0). Next genesis run 2026-09-16. Correct skip, not a failure.",
    "Loop is owner-paused: state-repo/state.json loops['repo-genesis-loop'].status == 'paused', note 'Paused by owner until the 2d crash test passes.' Owner decision, respected.",
    "Truth guard clear_to_proceed=false, blocking=[kinz-price-bridge created 2026-08-19, analytics-service-toolkit created 2026-08-19] - both inside the 21-day guard window (cutoff 2026-08-12).",
    "Lease was NOT acquired: the anchor gate closed before the claim, and --acquire writes last_run=<now>, which would have shifted the cadence anchor and pushed the real 2026-09-16 run to 2026-09-29. Nothing to release.",
    "No orphan empty repos on the profile: gh isEmpty filter returned zero rows, so the 2026-08-19 kinz-price-bridge orphan has since been scaffolded."
  ]
}
