{
  "loop": "cloud-daily-commit",
  "run_url": "https://claude.ai/code/session_01L4ePg4YMrSZodE5TSMgpae",
  "started": "2026-09-24T05:45:00Z",
  "ended": "2026-09-24T05:48:00Z",
  "status": "skipped",
  "prs_opened": 0,
  "prs_merged": 0,
  "prs_closed": 0,
  "tests_added": 0,
  "repos_touched": [],
  "pr_urls": [],
  "summary": "Something already landed today (author nassim0014, e.g. feed-quality-gate PR #3 at 00:49:27Z from the earlier cloud-improvements run) on multiple repos before this job ran, so per prompts/daily-commit.md step 2 no new work was needed.",
  "errors": []
}
