{
  "loop": "cloud-daily-commit",
  "run_url": "https://claude.ai/code/session_01229JTpaqyeDBdK39C9Waw9",
  "started": "2026-10-02T05:47:00Z",
  "ended": "2026-10-02T05:48:30Z",
  "status": "skipped",
  "prs_opened": 0,
  "prs_merged": 0,
  "prs_closed": 0,
  "tests_added": 0,
  "repos_touched": [],
  "pr_urls": [],
  "summary": "Something already landed today: nassim0014-authored commits at 2026-10-02T01:21-01:23Z in analytics-service-toolkit and Next.js-SaaS (from the earlier cloud-improvements run). Per job rule, stopped without making a new change.",
  "errors": []
}
