{
  "loop": "cloud-daily-commit",
  "run_url": "https://claude.ai/code/session_016YR7rEtw5CNHAGDJKythQE",
  "started": "2026-10-13T05:48:00Z",
  "ended": "2026-10-13T05:49:30Z",
  "status": "skipped",
  "prs_opened": 0,
  "prs_merged": 0,
  "prs_closed": 0,
  "tests_added": 0,
  "repos_touched": [],
  "pr_urls": [],
  "summary": "Something already landed today (Africa/Tunis): nassim0014 commit f75f8b8 on kinz-accounting-analysis-20260623-102129 (01:31 UTC) and 5027a69 on Next.js-SaaS (01:03 UTC), both merging the night's loop PRs. Nothing to do.",
  "errors": []
}
