{
  "loop": "cloud-maintenance",
  "run_url": "https://claude.ai/code/session_01GKhbb3oc82mjapxVj4WyZS",
  "started": "2026-10-12T00:46:56Z",
  "ended": "2026-10-12T01:15:03Z",
  "status": "success",
  "prs_opened": 1,
  "prs_merged": 0,
  "prs_closed": 0,
  "tests_added": 0,
  "repos_touched": ["btc-llm-sentiment"],
  "pr_urls": ["https://github.com/nassim0014/btc-llm-sentiment/pull/72"],
  "summary": "Checked all 9 non-infra repos in parallel. 8 were quiet (zero open PRs, main green, nothing to merge/fix). btc-llm-sentiment: Nassim's own merge of PR #71 exposed a pre-existing Trivy load:false bug in the Docker-build job; opened PR #72 with the one-line fix, but it edits an existing workflow file so this job can never merge it itself -- needs a human merge. kinz-secure-commerce-hub's standing blockers (Trivy OS CVE on main, coupled eslint10/Next16 majors, structurally mangled dependabot-rebase comments) and kinz-margin-guardian-pipeline's owner-blocked ASTK_PAT docker secret remain unchanged, no new action possible from this sandbox.",
  "errors": []
}
