{
  "loop": "cloud-maintenance",
  "run_url": "https://claude.ai/code/session_01M8cC8FtK4tAAqBDtyuwXHY",
  "started": "2026-10-04T00:38:00Z",
  "ended": "2026-10-04T00:53:27Z",
  "status": "success",
  "prs_opened": 0,
  "prs_merged": 0,
  "prs_closed": 0,
  "tests_added": 0,
  "repos_touched": [
    "analytics-service-toolkit",
    "btc-llm-sentiment",
    "kinz-accounting-analysis-20260623-102129",
    "feed-quality-gate",
    "kinz-competitor-intelligence",
    "kinz-margin-guardian-pipeline",
    "kinz-price-bridge",
    "kinz-secure-commerce-hub",
    "Next.js-SaaS"
  ],
  "pr_urls": [],
  "summary": "All 9 registry repos checked in parallel; nothing to merge/fix/close anywhere, so zero PRs opened/merged/closed. kinz-secure-commerce-hub has 6 dependabot PRs stuck dirty, and re-confirmed (via a second, different posting tool) that '@dependabot rebase' comments are structurally mangled by this session's comment-posting path regardless of which tool sends them. btc-llm-sentiment's main stays CI-red on the known unresolvable numpy/shap/tensorflow-cpu dependency graph, needing a dedicated full-stack re-pin session. kinz-secure-commerce-hub's main is CI-red only on an unfixable-from-sandbox Trivy OS CVE (Debian 13.7 base). Both btc-llm-sentiment and kinz-competitor-intelligence had their CLAUDE.md/backlog docs deleted directly on main by the human owner on 2026-10-02.",
  "errors": []
}
