{"loop":"repo-review-loop","agent":"claude-laptop","started":"2026-09-13T10:40:00Z","ended":"2026-09-13T10:53:16Z",
 "status":"success","prs_opened":0,"prs_merged":1,"prs_closed":0,"tests_added":0,
 "repos_touched":["kinz-secure-commerce-hub","btc-llm-sentiment","kinz-margin-guardian-pipeline","Next.js-SaaS"],"errors":[]}
