{
  "loop": "cloud-daily-commit",
  "run_url": "https://claude.ai/code/session_01QFXvHVidH34Fn3pJaCdFdh",
  "started": "2026-09-26T05:46:00Z",
  "ended": "2026-09-26T05:48:00Z",
  "status": "skipped",
  "prs_opened": 0,
  "prs_merged": 0,
  "prs_closed": 0,
  "tests_added": 0,
  "repos_touched": [],
  "pr_urls": [],
  "summary": "Something already landed today (Tunis) before this job ran: btc-llm-sentiment PR #59 (merge commit 371451336cfc0fb55fffe9e24c72775c8a4b9a1f, authored by nassim0014 at 2026-09-26T01:00:13Z) plus PR #58, feed-quality-gate PR #4 (f19acce74c73d4f74946cf3cb11322e519916d8d, 2026-09-26T01:00:21Z), and kinz-accounting-analysis PR #25 (2026-09-26T01:00:05Z) — all from the earlier cloud-maintenance/cloud-improvements/cloud-creative runs in this dispatch cycle. Per prompts/daily-commit.md step 2, stopped without making a change.",
  "errors": []
}
