{
  "loop": "cloud-kinz-improvement",
  "run_url": "https://claude.ai/code/session_018me1wBLedzpvQPR6oGp2Wb",
  "started": "2026-10-01T00:58:00Z",
  "ended": "2026-10-01T01:21:00Z",
  "status": "success",
  "prs_opened": 1,
  "prs_merged": 1,
  "prs_closed": 0,
  "tests_added": 4,
  "repos_touched": [
    "kinz-accounting-analysis-20260623-102129"
  ],
  "pr_urls": [
    "https://github.com/nassim0014/kinz-accounting-analysis-20260623-102129/pull/27"
  ],
  "summary": "Baseline pytest/ruff/verify_readonly all green. Followed up on the prior run's hint (scripts/export_builders.py 95% covered) and dashboard/pages/*.py; reviewed both in depth but found no live bug in either (dashboard key lookups all match what the generators produce, export_builders's three flagged branches are correctly handled, not buggy). Wrote 4 regression tests (each verified against a deliberately broken code path first) closing export_builders.py's coverage from 95%->100%, test-only, no production code changed. PR #27 opened, CI green, merge rules satisfied, squash-merged (37ae60f). No figure-changing work, so no hold/NEEDS YOU needed. Sonnet-only; no Opus escalation (no financial-correctness reasoning required). Two observations flagged for the owner but not acted on (out of scope): the dashboard's pipeline-runner intentionally skips extract_odoo_data.py (looks deliberate, not a bug); pandas 3.0 silently reinterprets a ragged CSV row via an implicit index column instead of raising, a pipeline-wide data-shape risk worth a future targeted look.",
  "errors": []
}
