{
  "loop": "repo-genesis-loop",
  "agent": "claude-laptop",
  "started": "2026-09-16T12:58:00Z",
  "ended": "2026-09-16T13:04:00Z",
  "status": "skipped",
  "prs_opened": 0,
  "prs_merged": 0,
  "prs_closed": 0,
  "tests_added": 0,
  "repos_touched": [],
  "errors": [
    "Lease refused by state_sync.py lease --acquire: {\"acquired\": false, \"reason\": \"last run 13d ago, min 27d\"} (exit 1). Stopped per protocol. Nothing claimed, nothing to release.",
    "Loop is also owner-paused: state.json loops['repo-genesis-loop'].status == 'paused' ('Paused by owner until the 2d crash test passes'). Owner decision, respected.",
    "28-day anchor gate alone would have opened today (day 28 since 2026-08-19), but the 2026-09-02 override run that created feed-quality-gate reset last_run; with min_days_between_runs=27 the next eligible date is on or after 2026-09-29, so the next Wednesday that passes both gates is ~2026-10-14 unless the owner re-anchors monthly_anchor.",
    "Validator gotcha: validate_config.py defaults --dir to the cwd. Run from /home/kiwif/loop-engine it validates the legacy top-level files and reports 48 errors; with --dir state-repo it reports VALID. The protocol assumes cwd=state-repo.",
    "Truth guard, orphan check, portfolio analysis and creation were not run: the protocol stops at the lease."
  ]
}
