{
  "loop": "repo-closed-loop",
  "agent": "claude-laptop",
  "started": "2026-09-04T17:12:08Z",
  "ended": "2026-09-04T17:29:25Z",
  "status": "success",
  "prs_opened": 2,
  "prs_merged": 0,
  "prs_closed": 0,
  "tests_added": 20,
  "repos_touched": ["Next.js-SaaS", "analytics-service-toolkit"],
  "errors": []
}
