{
  "loop": "cloud-daily-commit",
  "run_url": "https://claude.ai/code/session_01QFtqddaN6p4m47rQPShAsD",
  "started": "2026-10-04T05:47:00Z",
  "ended": "2026-10-04T05:47:30Z",
  "status": "skipped",
  "prs_opened": 0,
  "prs_merged": 0,
  "prs_closed": 0,
  "tests_added": 0,
  "repos_touched": [],
  "pr_urls": [],
  "summary": "Something already landed today: PR #28 (report_builders.py AR-tier coverage) merged in kinz-accounting-analysis-20260623-102129 at 2026-10-04T01:05:51Z by the cloud-kinz-improvement job, author login nassim0014. No fallback fix needed.",
  "errors": []
}
