{
  "loop": "cloud-daily-commit",
  "run_url": "https://claude.ai/code/session_01K5MsEEwTHUjZjNyQcEBuBu",
  "started": "2026-10-01T05:44:00Z",
  "ended": "2026-10-01T05:48:07Z",
  "status": "skipped",
  "prs_opened": 0,
  "prs_merged": 0,
  "prs_closed": 0,
  "tests_added": 0,
  "repos_touched": [],
  "pr_urls": [],
  "summary": "Something already landed today under nassim0014: kinz-accounting-analysis-20260623-102129@37ae60f (PR #27, merged 2026-10-01T01:09:57Z by the earlier cloud-kinz-improvement run). Stopped per step 2, no work done.",
  "errors": []
}
