{
  "loop": "cloud-maintenance",
  "run_url": "https://claude.ai/code/session_018me1wBLedzpvQPR6oGp2Wb",
  "started": "2026-10-01T00:48:00Z",
  "ended": "2026-10-01T00:57:30Z",
  "status": "partial",
  "prs_opened": 0,
  "prs_merged": 12,
  "prs_closed": 0,
  "tests_added": 0,
  "repos_touched": [
    "kinz-secure-commerce-hub",
    "Next.js-SaaS",
    "btc-llm-sentiment"
  ],
  "pr_urls": [
    "https://github.com/nassim0014/kinz-secure-commerce-hub/pull/68",
    "https://github.com/nassim0014/kinz-secure-commerce-hub/pull/67",
    "https://github.com/nassim0014/kinz-secure-commerce-hub/pull/66",
    "https://github.com/nassim0014/kinz-secure-commerce-hub/pull/63",
    "https://github.com/nassim0014/Next.js-SaaS/pull/104",
    "https://github.com/nassim0014/Next.js-SaaS/pull/103",
    "https://github.com/nassim0014/Next.js-SaaS/pull/102",
    "https://github.com/nassim0014/Next.js-SaaS/pull/101",
    "https://github.com/nassim0014/Next.js-SaaS/pull/100",
    "https://github.com/nassim0014/Next.js-SaaS/pull/98",
    "https://github.com/nassim0014/Next.js-SaaS/pull/97",
    "https://github.com/nassim0014/Next.js-SaaS/pull/96"
  ],
  "summary": "Checked every registry repo for open PRs and default-branch CI. Merged 12 green, no-conflict dependabot PRs across kinz-secure-commerce-hub (4) and Next.js-SaaS (8). No agent PRs found anywhere. Left 11 PRs open: 5 major-bump frontend PRs with real peer-dependency CI failures (not small fixes), 2 conflicted PRs where the '@dependabot rebase' comment renders mangled by this session and never actually triggers the bot (flagged for the owner), and 5 btc-llm-sentiment dependabot PRs blocked by the already-documented pre-existing Docker build failure (confirmed by direct testing that the one-line fix does not work -- a real numpy/shap pin conflict needs a coordinated re-pin, not attempted this run).",
  "errors": [
    "kinz-secure-commerce-hub #64 and #37: conflicted, but the '@dependabot rebase' PR comment posted by this session renders as '·@·d·ependabot r·ebase' when read back -- a mangled, non-functional mention. Could not actually ask dependabot to rebase. Needs owner attention or investigation of the comment-posting path.",
    "Next.js-SaaS #95: same mangled-comment issue, left open rather than closed.",
    "github MCP list_pull_requests tool wrongly returned an empty list for btc-llm-sentiment this run; REST API showed 5 open PRs. Cross-checked and handled via REST; flagging the tool discrepancy for future runs."
  ]
}
